{
  "runId": "5f0c1a2b-3c4d-4e5f-8a9b-0c1d2e3f4a5b",
  "passportId": "7a1b2c3d-4e5f-4a6b-9c7d-8e9f0a1b2c3d",
  "status": "completed",
  "terminalReason": null,
  "cancelRequestedAt": null,
  "createdAt": "2026-10-03T12:00:00Z",
  "updatedAt": "2026-10-03T12:09:00Z",
  "resultReference": {
    "reportIds": ["4d5e6f70-8192-4a3b-8c5d-6e7f8091a2b3", "5e6f7081-92a3-4b4c-9d6e-7f8091a2b3c4"]
  }
}
